{
  "$schema": "./komoda.schema.json",
  "id": "komoda-prebalovaci-pult",
  "name": "Komoda / prebaľovací pult",
  "version": "1.1.0",
  "revision": "2026-10-14",
  "units": "mm",
  "note": "Toto je JEDINÝ zdroj pravdy pre geometriu. Odvodené rozmery počíta scripts/build.mjs — nezapisuj ich sem ručne.",

  "overall": {
    "width": 1800,
    "height": 1050,
    "depth": 650
  },

  "materials": {
    "ldtd25": {
      "type": "LDTD",
      "thickness": 25,
      "decor": "light-oak",
      "decorCode": null,
      "finish": "matt",
      "abrasionClass": "AC3",
      "emissionClass": "E1",
      "use": "horná doska"
    },
    "ldtd18": {
      "type": "LDTD",
      "thickness": 18,
      "decor": "light-oak",
      "decorCode": null,
      "finish": "matt",
      "emissionClass": "E1",
      "use": "korpus, čelá, výstuha"
    },
    "ldtd16": {
      "type": "LDTD",
      "thickness": 16,
      "decor": "light-oak",
      "decorCode": null,
      "emissionClass": "E1",
      "use": "boky zásuvkových boxov"
    },
    "hdf10": {
      "type": "HDF",
      "thickness": 10,
      "use": "dná zásuviek"
    },
    "hdf8": {
      "type": "HDF",
      "thickness": 8,
      "use": "chrbát"
    }
  },

  "edging": {
    "material": "ABS",
    "thickness": 2,
    "printed": true,
    "matchDecor": true,
    "note": "Pri drevenom dekore musí byť hrana s potlačou. Jednofarebná hrana je na dube okamžite vidieť."
  },

  "plinth": {
    "type": "frame",
    "height": 60,
    "material": "ldtd18",
    "inset": { "front": 50, "left": 50, "right": 50, "rear": 30 },
    "insetNote": "front sa meria od roviny čiel (z 0), nie od čelnej hrany korpusu. rear je odsadenie od steny, aby pod komodu vošla soklová lišta — over jej hrúbku.",
    "floorGap": 15,
    "middleBoard": true,
    "levelers": {
      "type": "rektifikačná pätka v spodnej hrane rámu",
      "count": 6,
      "adjustRangeApprox": 15,
      "layout": "4 rohy rámu + 2 pod strednou priečkou",
      "note": "Rám nesie korpus a stojí na pätkách. floorGap je ich vysunutie v strednej polohe."
    },
    "note": "Samostatný rám pod nezmeneným korpusom. Stredná doska rámu je pod priečkou, ktorá inak nemá oporu. Vôľa pod rámom musí byť aspoň taká ako rozsah rektifikácie, inak pri znížení pätiek dosadne rám na podlahu."
  },

  "carcass": {
    "height": 990,
    "construction": "boky stoja na dne; horná doska leží na bokoch",
    "parts": {
      "bottom": { "material": "ldtd18", "spansFullWidth": true },
      "sides": { "material": "ldtd18", "count": 2 },
      "divider": { "material": "ldtd18", "count": 1, "fullHeight": true, "position": "center" },
      "top": {
        "material": "ldtd25",
        "width": 1800,
        "depth": 650,
        "overhang": { "front": 18, "left": 0, "right": 0 },
        "note": "Presah vpredu 18 mm je nutný, aby doska lícovala s full-overlay čelami."
      },
      "rearRail": {
        "material": "ldtd18",
        "height": 100,
        "position": "top-rear",
        "mountedInFrontOf": "back",
        "purpose": "kotvenie do steny — do 8 mm HDF sa kotva dať nedá"
      },
      "back": {
        "material": "hdf8",
        "count": 2,
        "split": "na strednej priečke",
        "groove": { "width": 8, "depth": 10, "insetFromRear": 15 }
      }
    }
  },

  "gola": {
    "system": "SALU / Tulip GOLA alebo ekvivalent",
    "finish": "black-matt",
    "finishAlternative": "hliník anodizovaný",
    "top": {
      "profileType": "J",
      "reveal": 22,
      "count": 1,
      "lengthEach": 1800,
      "position": "pod hornou doskou"
    },
    "between": {
      "profileType": "C",
      "reveal": 21,
      "count": 3,
      "lengthEach": 1800,
      "profileHeight": 73.5,
      "profileDepth": 26,
      "position": "medzi radmi zásuviek"
    },
    "revealIsTarget": true,
    "note": "Reveal 21/22 mm je ZVOLENÝ cieľ, nie odčítaný z datasheetu. Pri objednávke over v montážnom návode. Ak sa líši, uprav reveal tu a spusti build — výšky čiel sa musia prepočítať a invariant sumFronts to zachytí."
  },

  "fronts": {
    "material": "ldtd18",
    "overlay": "full",
    "columns": 2,
    "rows": 4,
    "width": 898,
    "centerGap": 4,
    "sideGap": 0,
    "heights": [190, 190, 190, 310],
    "heightsNote": "Odstupňované — spodný rad vyšší na objemné veci (plienky, deky). Vnútorná výška spodného boxu 230 mm, horných 130 mm (počíta build).",
    "grain": {
      "direction": "horizontal",
      "sequentialCut": true,
      "note": "Čelá rezať v poradí z jednej dosky, aby kresba dubu na sebe nadväzovala."
    }
  },

  "drawers": {
    "count": 8,
    "boxDepth": 550,
    "boxSideMaterial": "ldtd16",
    "boxBottomMaterial": "hdf10",
    "boxSideHeights": [150, 150, 150, 250],
    "slide": {
      "mount": "side",
      "extension": "full",
      "softClose": true,
      "length": 550,
      "clearancePerSide": 12.7,
      "loadKg": 40,
      "note": "12,7 mm (½\") je priemyselný štandard pre bočné guličkové výsuvy. Over v datasheete pred nárezom boxov."
    }
  },

  "changingPad": {
    "width": 800,
    "depth": 600,
    "thickness": null,
    "removable": true,
    "raisedSides": true,
    "alignment": { "horizontal": "center", "depth": "rear" },
    "status": "PLACEHOLDER",
    "note": "Rozmery sú placeholder, nie reálny produkt. Pôvodných 800 × 700 z výkresu sa na dosku hlbokú 650 nezmestí. Kúpiť podložku PRVÚ (hĺbka najviac 650), potom zakótovať zónu podľa nej. Bežné podložky majú 700–850 × 500–750 mm."
  },

  "wallAnchor": {
    "required": true,
    "reason": "1050 mm vysoká komoda s 8 vysúvateľnými zásuvkami — riziko preklopenia",
    "wallType": "brick",
    "count": 3,
    "fastener": "nylonová hmoždinka 10 × 80",
    "through": "rearRail",
    "positions": ["pri ľavom boku", "pri strednej priečke", "pri pravom boku"]
  },

  "joinery": {
    "carcass": "kolíky + excenter (minifix)",
    "rationale": "rozoberateľné",
    "drawerBox": "podľa technológie zhotoviteľa"
  },

  "openQuestions": [
    {
      "id": "gola-reveal-verify",
      "q": "Over reveal zvoleného gola profilu v montážnom návode.",
      "impact": "Ak nie je 21/22 mm, prepočítajú sa výšky čiel (súčet musí ostať 965).",
      "blocking": true
    },
    {
      "id": "pad-dimensions",
      "q": "Reálne rozmery a hrúbka kúpenej prebaľovacej podložky.",
      "impact": "Zóna na doske + finálna pracovná výška.",
      "blocking": false
    },
    {
      "id": "skirting",
      "q": "Hrúbka a výška soklovej lišty na stene za komodou.",
      "impact": "Lišta smie byť najviac 30 mm hrubá (plinth.inset.rear) a 60 mm vysoká (dno korpusu je na 60). Inak komoda nedosadne k stene — treba zväčšiť odsadenie, alebo lištu za komodou odrezať.",
      "blocking": false
    },
    {
      "id": "decor-code",
      "q": "Konkrétny kód dekoru svetlý dub podľa vzorkovníka (Egger / Kronospan / Pfleiderer).",
      "impact": "Objednávka materiálu a ABS hrán.",
      "blocking": false
    }
  ],

  "decidedElsewhere": {
    "workingHeight": "Ponechané 1050 mm napriek tomu, že s podložkou vyjde ~1090 mm (bežná prebaľovacia výška je 950–1000 mm). Vedomé rozhodnutie — pozri docs/decisions.md."
  }
}
